{
  "id": "tra-cross-region",
  "version": "1.0.0",
  "displayName": {
    "zh-CN": "异地就医报销",
    "en": "Cross-Region Medical Reimbursement"
  },
  "domain": [
    "cross-region",
    "insurance",
    "reimbursement"
  ],
  "openclaw": {
    "agentId": "tra-cross-region"
  },
  "tools": {
    "read": "trustclaw_tra_query"
  },
  "prompts": {
    "system": "prompts/system.v1.md",
    "text2sql": "prompts/text2sql.v1.md"
  },
  "data": {
    "readTables": [
      "clinical_diagnoses",
      "lab_test_results",
      "body_anthropometrics",
      "user_profile",
      "data_source_registry",
      "nrdl_drug_registry",
      "nrdl_payment_rules"
    ]
  },
  "rules": {
    "engine": "nrdl-table",
    "activeStandardHint": "glp1-nrdl-ast-handshake-v2"
  },
  "pipeline": {
    "stages": [
      "TEXT2SQL_GEN",
      "DB_QUERY",
      "RULE_EVAL",
      "AGENT_DECISION",
      "LEDGER_COMMIT"
    ],
    "decisionBuilder": "pass-through"
  },
  "consent": {
    "read": {
      "allowAlways": true
    }
  },
  "audit": {
    "businessComponent": "TRA.Agent.CrossRegion",
    "decisionComponent": "Agent.CrossRegionDecision",
    "ruleEvalComponent": "AgentRuntime.ExecRule"
  }
}
